{
  "type": "grid-system",
  "id": "grid_2x2_mirror_kaleido",
  "name": "Mirrored kaleidoscope",
  "version": 1,
  "rows": 2,
  "cols": 2,
  "gutter_px": 0,
  "margin_px": 0,
  "feather_px": 24,
  "corner_radius_px": 0,
  "cells": [
    {
      "source": "bg_layer_ocean_waves",
      "opacity": 0.38,
      "mirror": ""
    },
    {
      "source": "bg_layer_ocean_waves",
      "opacity": 0.38,
      "mirror": "h"
    },
    {
      "source": "bg_layer_ocean_waves",
      "opacity": 0.38,
      "mirror": "v"
    },
    {
      "source": "bg_layer_ocean_waves",
      "opacity": 0.38,
      "mirror": "hv"
    }
  ],
  "placement": {
    "as": "background-layer",
    "blend": "screen",
    "layer_opacity": 0.98
  },
  "canvas": {
    "width": 1080,
    "height": 1920,
    "fps": 30
  },
  "rects": [
    [
      0,
      0,
      540,
      960
    ],
    [
      540,
      0,
      540,
      960
    ],
    [
      0,
      960,
      540,
      960
    ],
    [
      540,
      960,
      540,
      960
    ]
  ],
  "render": {
    "filtergraph_file": "filtergraph.txt",
    "standalone": true,
    "inputs": "none (procedural cells and base gradient are generated inside the graph)"
  },
  "target": {
    "id": "generic_9x16",
    "label": "Vertical 9:16 (generic)",
    "platform": "generic",
    "aspect": "9:16",
    "width": 1080,
    "height": 1920,
    "safe_margins": {
      "top": 0.08,
      "bottom": 0.2,
      "left": 0.06,
      "right": 0.06
    },
    "margins_basis": "House margins (not a platform specification). Chosen to keep text clear of typical top bars, right-hand action buttons and bottom description areas. Not verified against platform documentation on 2026-10-10; preview on the platform before publishing."
  },
  "use_when": [
    "Abstract energy from a single loop",
    "Symmetric patterns"
  ],
  "cell_set": "nature"
}
